{
  "brand": "Your Brand Name",
  "legal_name": "Your Legal Entity Name LLC",
  "website": "yourdomain.com",
  "category": "Industry — Subcategory",
  "locale": "en-US",
  "last_updated": "2025-01-01",
  "version": "0.1.0",
  "taglines": [
    "Primary tagline",
    "Secondary tagline (optional)"
  ],
  "positioning": {
    "statement": "One or two sentence positioning statement describing what you do and who you serve.",
    "for": "Target audience description",
    "category": "Category you compete in",
    "benefit": "Primary benefit or value delivered"
  },
  "differentiation": "Unlike [alternative], we [key differentiator].",
  "markets": [
    "City, State",
    "Region or demographic"
  ],
  "audience": {
    "primary": "One sentence describing who the ideal customer is.",
    "pain_points": [
      "What they are trying to solve or escape"
    ],
    "motivations": [
      "What they are trying to achieve or become"
    ]
  },
  "services": [
    "Service or product one",
    "Service or product two"
  ],
  "restrictions": [
    "Do not make specific outcome guarantees",
    "Do not reference competitors by name"
  ],
  "imagery_style": [
    "Real people, candid",
    "Natural light, outdoor or environmental settings"
  ],
  "colors": {
    "primary": { "hex": "#000000", "usage": "Headlines, primary CTAs, key UI elements" },
    "accent": { "hex": "#ffffff", "usage": "CTA backgrounds, highlights, contrast elements" },
    "background": { "hex": "#f5f5f5", "usage": "Page and section backgrounds" }
  },
  "accessible_pairs": [
    { "text": "accent", "bg": "primary" },
    { "text": "primary", "bg": "background" }
  ],
  "color_mode": "light",
  "typography": {
    "headings": {
      "stack": "\"Font Name\", sans-serif",
      "weight": 700,
      "size": "2rem",
      "line_height": "1.2"
    },
    "body": {
      "stack": "\"Font Name\", serif",
      "weight": 400,
      "size": "1rem",
      "line_height": "1.6"
    }
  },
  "logo": {
    "description": "Brief description of logo mark and wordmark",
    "logo_style": "combination",
    "has_icon_variant": false,
    "color": "logo-color.png",
    "white": "logo-white.png"
  },
  "social": {
    "twitter": "@handle",
    "linkedin": "linkedin.com/company/yourcompany"
  },
  "voice": {
    "tone": ["adjective", "adjective", "adjective"],
    "avoid": ["adjective", "adjective"],
    "examples": [
      "Sample sentence that exemplifies the brand voice.",
      "Another example showing how the brand speaks to its audience."
    ]
  }
}
